{
  "url": "https://test.test/test/job",
  "uuid": "9ecb3e0d-41e1-54e7-a24d-e3975111e5a2",
  "title": "This a test document - job",
  "source": [1503],
  "country": [13, 14],
  "body": "This is the **body** text in markdown format.\n\nIt has some paragraphs  \nand a line break.\n<h1>TITLE</h1><p>paragraph 1 <strong>bold</strong></p><ul><li>item1</li><li>item2</li></ul><p>paragraph 2 <a href=\"https://link.test\">link</a></p>",
  "how_to_apply": "Send us an **email**.",
  "closing_date": "2029-06-06T01:00:00+00:00",
  "job_type": [263],
  "job_experience": [260],
  "career_category": [36601],
  "theme": [4587]
}
